{"schema_version":2,"collection":"engineering-skills-for-go","display_name":"Go Service Boundaries","short_description":"Protect network protocol boundaries","default_prompt":"Use $go-service-boundaries to engineer this Go service protocol boundary.","version":"0.2.0","maturity":"beta","category":"boundary","risk_domains":["correctness","security","availability","compatibility"],"tags":["go","http","grpc","graphql","openapi","streaming"],"go_versions":{"minimum":"1.24","guidance":["1.25","1.26"]},"claim_ids":["eng-protocol-boundary"],"relations":{"complements":["go-project-and-api-design","go-production-operations","go-service-resilience"],"overlaps":[]},"compatibility_evidence":[{"client":"codex","level":"behaviorally-benchmarked","contract":"OpenAI skill plus agents/openai.yaml and committed eval artifacts","verified_on":"2026-08-18"},{"client":"claude-code","level":"structurally-compatible","contract":"Claude plugin skill layout and manifest validation","verified_on":"2026-08-18"},{"client":"cursor","level":"structurally-compatible","contract":"Agent Plugin and .cursor/skills layout validation","verified_on":"2026-08-18"},{"client":"opencode","level":"structurally-compatible","contract":".agents/skills layout and portable frontmatter validation","verified_on":"2026-08-18"}],"source_provenance":{"method":"independent-rewrite-from-primary-evidence","reference_repositories":["cc-skills-golang","gophers"],"corpus_lock":"research/corpus-lock.json"},"sources":[{"title":"Package net/http","url":"https://pkg.go.dev/net/http","publisher":"The Go Authors","kind":"normative","verified_on":"2026-08-18","supports":["server lifecycle","client ownership","timeouts"]},{"title":"gRPC Guides","url":"https://grpc.io/docs/guides/","publisher":"Cloud Native Computing Foundation","kind":"primary","verified_on":"2026-08-18","supports":["status","deadlines","streaming","retry"]}]}
