{"schema_version":2,"collection":"fintech-skills-for-go","display_name":"Review Go Fintech Change","short_description":"Find financial-integrity defects","default_prompt":"Use $review-go-fintech-change to review this Go diff for financial-integrity failures.","version":"0.2.0","maturity":"beta","category":"review","risk_domains":["financial-integrity","security","auditability","reconciliation"],"tags":["go","fintech","review","payments","ledger","reconciliation"],"go_versions":{"minimum":"1.24","guidance":["1.25","1.26"]},"claim_ids":["fin-money-representation","fin-ledger-invariants","fin-payment-state-machine","fin-idempotency-record","fin-settlement-evidence","fin-reconciliation-control","fin-data-boundaries","benchmark-methodology"],"relations":{"complements":["review-go-engineering-change","review-go-distributed-change"],"overlaps":[]},"compatibility_evidence":[{"client":"codex","level":"behaviorally-benchmarked","contract":"OpenAI skill plus agents/openai.yaml and committed eval artifacts","verified_on":"2026-08-18"},{"client":"claude-code","level":"structurally-compatible","contract":"Claude plugin skill layout and manifest validation","verified_on":"2026-08-18"},{"client":"cursor","level":"structurally-compatible","contract":"Agent Plugin and .cursor/skills layout validation","verified_on":"2026-08-18"},{"client":"opencode","level":"structurally-compatible","contract":".agents/skills layout and portable frontmatter validation","verified_on":"2026-08-18"}],"source_provenance":{"method":"independent-rewrite-from-primary-evidence","reference_repositories":[],"corpus_lock":"research/corpus-lock.json"},"sources":[{"title":"ISO 4217 Currency Codes","url":"https://www.iso.org/standard/64758.html","publisher":"ISO","kind":"normative","verified_on":"2026-08-18","supports":["money representation","currency"]},{"title":"PCI Data Security Standard","url":"https://www.pcisecuritystandards.org/standards/pci-dss/","publisher":"PCI Security Standards Council","kind":"primary","verified_on":"2026-08-18","supports":["payment-data boundaries","audit"]}]}
