{"schema_version":2,"collection":"fintech-skills-for-go","display_name":"Go Fintech Security and Compliance","short_description":"Constrain financial trust and data scope","default_prompt":"Use $go-fintech-security-compliance to engineer this Go fintech trust boundary.","version":"0.2.0","maturity":"beta","category":"compliance","risk_domains":["security","privacy","compliance","auditability"],"tags":["go","fintech","pci-dss","authorization","audit","tokenization"],"go_versions":{"minimum":"1.24","guidance":["1.25","1.26"]},"claim_ids":["fin-data-boundaries"],"relations":{"complements":["go-security-hardening","review-go-fintech-change"],"overlaps":[]},"compatibility_evidence":[{"client":"codex","level":"behaviorally-benchmarked","contract":"OpenAI skill plus agents/openai.yaml and committed eval artifacts","verified_on":"2026-08-18"},{"client":"claude-code","level":"structurally-compatible","contract":"Claude plugin skill layout and manifest validation","verified_on":"2026-08-18"},{"client":"cursor","level":"structurally-compatible","contract":"Agent Plugin and .cursor/skills layout validation","verified_on":"2026-08-18"},{"client":"opencode","level":"structurally-compatible","contract":".agents/skills layout and portable frontmatter validation","verified_on":"2026-08-18"}],"source_provenance":{"method":"independent-rewrite-from-primary-evidence","reference_repositories":[],"corpus_lock":"research/corpus-lock.json"},"sources":[{"title":"PCI Data Security Standard","url":"https://www.pcisecuritystandards.org/document_library/","publisher":"PCI Security Standards Council","kind":"primary","verified_on":"2026-08-24","supports":["PCI DSS v4.0.1","account data","sensitive authentication data","security controls","scope"]},{"title":"NIST SP 800-63B","url":"https://pages.nist.gov/800-63-4/sp800-63b.html","publisher":"NIST","kind":"normative","verified_on":"2026-08-18","supports":["authentication assurance","authenticators"]}]}
