{"schema_version":2,"collection":"distributed-systems-skills-for-go","display_name":"Review Go Distributed Change","short_description":"Find distributed failure schedules","default_prompt":"Use $review-go-distributed-change to review this Go diff for distributed failure schedules.","version":"0.2.0","maturity":"beta","category":"review","risk_domains":["concurrency","consistency","availability","recovery"],"tags":["go","review","distributed-systems","partial-failure","ordering","recovery"],"go_versions":{"minimum":"1.24","guidance":["1.25","1.26"]},"claim_ids":["dist-bounded-concurrency","dist-transaction-invariant","dist-delivery-semantics","dist-retry-budget","dist-coordination-safety","benchmark-methodology"],"relations":{"complements":["review-go-engineering-change","review-go-fintech-change"],"overlaps":[]},"compatibility_evidence":[{"client":"codex","level":"behaviorally-benchmarked","contract":"OpenAI skill plus agents/openai.yaml and committed eval artifacts","verified_on":"2026-08-18"},{"client":"claude-code","level":"structurally-compatible","contract":"Claude plugin skill layout and manifest validation","verified_on":"2026-08-18"},{"client":"cursor","level":"structurally-compatible","contract":"Agent Plugin and .cursor/skills layout validation","verified_on":"2026-08-18"},{"client":"opencode","level":"structurally-compatible","contract":".agents/skills layout and portable frontmatter validation","verified_on":"2026-08-18"}],"source_provenance":{"method":"independent-rewrite-from-primary-evidence","reference_repositories":["cc-skills-golang","cxuu-golang-skills","gophers"],"corpus_lock":"research/corpus-lock.json"},"sources":[{"title":"The Go Memory Model","url":"https://go.dev/ref/mem","publisher":"The Go Authors","kind":"normative","verified_on":"2026-08-18","supports":["concurrent execution","synchronization"]},{"title":"PostgreSQL Transaction Isolation","url":"https://www.postgresql.org/docs/current/transaction-iso.html","publisher":"PostgreSQL Global Development Group","kind":"primary","verified_on":"2026-08-18","supports":["concurrent transaction schedules"]}]}
