{"schema_version":2,"collection":"fintech-skills-for-go","display_name":"Go Settlement and Reconciliation","short_description":"Match every external money movement","default_prompt":"Use $go-clearing-settlement-reconciliation to design this Go settlement or reconciliation flow.","version":"0.2.0","maturity":"beta","category":"settlement","risk_domains":["settlement","reconciliation","financial-integrity"],"tags":["go","clearing","settlement","reconciliation","payouts","exceptions","fedwire","finality"],"go_versions":{"minimum":"1.24","guidance":["1.25","1.26"]},"claim_ids":["fin-settlement-evidence","fin-reconciliation-control"],"relations":{"complements":["go-money-and-ledgers","go-payment-lifecycles"],"overlaps":[]},"compatibility_evidence":[{"client":"codex","level":"behaviorally-benchmarked","contract":"OpenAI skill plus agents/openai.yaml and committed eval artifacts","verified_on":"2026-08-18"},{"client":"claude-code","level":"structurally-compatible","contract":"Claude plugin skill layout and manifest validation","verified_on":"2026-08-18"},{"client":"cursor","level":"structurally-compatible","contract":"Agent Plugin and .cursor/skills layout validation","verified_on":"2026-08-18"},{"client":"opencode","level":"structurally-compatible","contract":".agents/skills layout and portable frontmatter validation","verified_on":"2026-08-18"}],"source_provenance":{"method":"independent-rewrite-from-primary-evidence","reference_repositories":[],"corpus_lock":"research/corpus-lock.json"},"sources":[{"title":"Stripe reconciliation reports","url":"https://docs.stripe.com/reports/reconciliation","publisher":"Stripe","kind":"primary","verified_on":"2026-08-18","supports":["report evidence","reconciliation"]},{"title":"Fedwire Funds Service","url":"https://www.federalreserve.gov/paymentsystems/fedfunds_about.htm","publisher":"Federal Reserve Board","kind":"primary","verified_on":"2026-08-18","supports":["settlement","finality"]},{"title":"Operating Circular 6: Funds Transfers through the Fedwire Funds Service","url":"https://www.frbservices.org/binaries/content/assets/crsocms/resources/rules-regulations/010526-operating-circular-6.pdf","publisher":"Federal Reserve Banks","kind":"primary","verified_on":"2026-08-24","supports":["acceptance and payment evidence","cancellation and contingency reconciliation","protracted-outage finality"]}]}
