{"schema_version":2,"collection":"engineering-skills-for-go","display_name":"Review Go Engineering Change","short_description":"Find causal defects in a Go diff","default_prompt":"Use $review-go-engineering-change to review this Go diff for actionable defects.","version":"0.2.0","maturity":"beta","category":"review","risk_domains":["correctness","security","compatibility","operations"],"tags":["go","review","diff","correctness","security","compatibility"],"go_versions":{"minimum":"1.24","guidance":["1.25","1.26","1.27"]},"claim_ids":["eng-language-clarity","eng-dependency-direction","eng-protocol-boundary","eng-verification-by-risk","eng-measure-before-optimize","eng-security-boundary","eng-operational-lifecycle","benchmark-methodology","repository-mechanics"],"relations":{"complements":["review-go-distributed-change","review-go-fintech-change"],"overlaps":[]},"compatibility_evidence":[{"client":"codex","level":"behaviorally-benchmarked","contract":"OpenAI skill plus agents/openai.yaml and committed eval artifacts","verified_on":"2026-08-18"},{"client":"claude-code","level":"structurally-compatible","contract":"Claude plugin skill layout and manifest validation","verified_on":"2026-08-18"},{"client":"cursor","level":"structurally-compatible","contract":"Agent Plugin and .cursor/skills layout validation","verified_on":"2026-08-18"},{"client":"opencode","level":"structurally-compatible","contract":".agents/skills layout and portable frontmatter validation","verified_on":"2026-08-18"}],"source_provenance":{"method":"independent-rewrite-from-primary-evidence","reference_repositories":["cc-skills-golang","cxuu-golang-skills","gophers"],"corpus_lock":"research/corpus-lock.json"},"sources":[{"title":"Go Code Review Comments","url":"https://go.dev/wiki/CodeReviewComments","publisher":"The Go Authors","kind":"primary","verified_on":"2026-08-18","supports":["review conventions","correctness distinctions"]},{"title":"The Go Programming Language Specification","url":"https://go.dev/ref/spec","publisher":"The Go Authors","kind":"normative","verified_on":"2026-08-18","supports":["language correctness","compatibility"]},{"title":"OpenAI Evals design guide","url":"https://platform.openai.com/docs/guides/evals","publisher":"OpenAI","kind":"primary","verified_on":"2026-08-18","supports":["evaluation methodology","reproducibility"]}]}
